{
	"crsf_version": "1.0-draft-phase2zg",
	"asvs": "5.0.0",
	"input": "security/crsf/vendor/asvs-5.0.0.flat.json",
	"input_sha256": "8201b20eec2908c3380ac600c91c8ba746346fbb808859366abb232027532311",
	"count": 345,
	"items": [
		{
			"req_id": "V1.1.1",
			"level": "L2",
			"applicability": "APPLICABLE",
			"reason": "",
			"controls": [
				"CR-INPUT-001"
			],
			"conformance_status": "NOT_DEMONSTRATED",
			"release_relevance": "SECURITY_DEBT"
		},
		{
			"req_id": "V1.1.2",
			"level": "L2",
			"applicability": "APPLICABLE",
			"reason": "",
			"controls": [
				"CR-INPUT-002"
			],
			"conformance_status": "NOT_DEMONSTRATED",
			"release_relevance": "SECURITY_DEBT"
		},
		{
			"req_id": "V1.2.1",
			"level": "L1",
			"applicability": "APPLICABLE",
			"reason": "",
			"controls": [
				"CR-BROWSER-004"
			],
			"conformance_status": "CONFORMANT",
			"release_relevance": "RELEASE_BLOCKING"
		},
		{
			"req_id": "V1.2.2",
			"level": "L1",
			"applicability": "APPLICABLE",
			"reason": "",
			"controls": [
				"CR-INPUT-003"
			],
			"conformance_status": "NOT_DEMONSTRATED",
			"release_relevance": "SECURITY_DEBT"
		},
		{
			"req_id": "V1.2.3",
			"level": "L1",
			"applicability": "APPLICABLE",
			"reason": "",
			"controls": [
				"CR-INPUT-002"
			],
			"conformance_status": "NOT_DEMONSTRATED",
			"release_relevance": "SECURITY_DEBT"
		},
		{
			"req_id": "V1.2.4",
			"level": "L1",
			"applicability": "APPLICABLE",
			"reason": "",
			"controls": [
				"CR-INPUT-004"
			],
			"conformance_status": "CONFORMANT",
			"release_relevance": "RELEASE_BLOCKING"
		},
		{
			"req_id": "V1.2.5",
			"level": "L1",
			"applicability": "APPLICABLE",
			"reason": "",
			"controls": [
				"CR-INPUT-005"
			],
			"conformance_status": "NOT_DEMONSTRATED",
			"release_relevance": "SECURITY_DEBT"
		},
		{
			"req_id": "V1.2.6",
			"level": "L2",
			"applicability": "NOT_APPLICABLE",
			"reason": "No LDAP, XPath, LaTeX or CSV export.",
			"controls": [],
			"conformance_status": "NOT_APPLICABLE",
			"release_relevance": "NONE"
		},
		{
			"req_id": "V1.2.7",
			"level": "L2",
			"applicability": "NOT_APPLICABLE",
			"reason": "No LDAP, XPath, LaTeX or CSV export.",
			"controls": [],
			"conformance_status": "NOT_APPLICABLE",
			"release_relevance": "NONE"
		},
		{
			"req_id": "V1.2.8",
			"level": "L2",
			"applicability": "NOT_APPLICABLE",
			"reason": "No LDAP, XPath, LaTeX or CSV export.",
			"controls": [],
			"conformance_status": "NOT_APPLICABLE",
			"release_relevance": "NONE"
		},
		{
			"req_id": "V1.2.9",
			"level": "L2",
			"applicability": "APPLICABLE",
			"reason": "",
			"controls": [
				"CR-INPUT-006"
			],
			"conformance_status": "NOT_DEMONSTRATED",
			"release_relevance": "SECURITY_DEBT"
		},
		{
			"req_id": "V1.2.10",
			"level": "L3",
			"applicability": "NOT_APPLICABLE",
			"reason": "No LDAP, XPath, LaTeX or CSV export.",
			"controls": [],
			"conformance_status": "NOT_APPLICABLE",
			"release_relevance": "NONE"
		},
		{
			"req_id": "V1.3.1",
			"level": "L1",
			"applicability": "NOT_APPLICABLE",
			"reason": "No WYSIWYG/SVG/markdown-template user content, JNDI, memcache or mail system.",
			"controls": [],
			"conformance_status": "NOT_APPLICABLE",
			"release_relevance": "NONE"
		},
		{
			"req_id": "V1.3.2",
			"level": "L1",
			"applicability": "APPLICABLE",
			"reason": "",
			"controls": [
				"CR-BROWSER-004"
			],
			"conformance_status": "CONFORMANT",
			"release_relevance": "RELEASE_BLOCKING"
		},
		{
			"req_id": "V1.3.3",
			"level": "L2",
			"applicability": "APPLICABLE",
			"reason": "",
			"controls": [
				"CR-INPUT-007"
			],
			"conformance_status": "NOT_DEMONSTRATED",
			"release_relevance": "SECURITY_DEBT"
		},
		{
			"req_id": "V1.3.4",
			"level": "L2",
			"applicability": "NOT_APPLICABLE",
			"reason": "No WYSIWYG/SVG/markdown-template user content, JNDI, memcache or mail system.",
			"controls": [],
			"conformance_status": "NOT_APPLICABLE",
			"release_relevance": "NONE"
		},
		{
			"req_id": "V1.3.5",
			"level": "L2",
			"applicability": "NOT_APPLICABLE",
			"reason": "No WYSIWYG/SVG/markdown-template user content, JNDI, memcache or mail system.",
			"controls": [],
			"conformance_status": "NOT_APPLICABLE",
			"release_relevance": "NONE"
		},
		{
			"req_id": "V1.3.6",
			"level": "L2",
			"applicability": "APPLICABLE",
			"reason": "",
			"controls": [
				"CR-PROVIDER-003"
			],
			"conformance_status": "CONFORMANT",
			"release_relevance": "RELEASE_BLOCKING"
		},
		{
			"req_id": "V1.3.7",
			"level": "L2",
			"applicability": "APPLICABLE",
			"reason": "",
			"controls": [
				"CR-INPUT-013"
			],
			"conformance_status": "NOT_DEMONSTRATED",
			"release_relevance": "SECURITY_DEBT"
		},
		{
			"req_id": "V1.3.8",
			"level": "L2",
			"applicability": "NOT_APPLICABLE",
			"reason": "No WYSIWYG/SVG/markdown-template user content, JNDI, memcache or mail system.",
			"controls": [],
			"conformance_status": "NOT_APPLICABLE",
			"release_relevance": "NONE"
		},
		{
			"req_id": "V1.3.9",
			"level": "L2",
			"applicability": "NOT_APPLICABLE",
			"reason": "No WYSIWYG/SVG/markdown-template user content, JNDI, memcache or mail system.",
			"controls": [],
			"conformance_status": "NOT_APPLICABLE",
			"release_relevance": "NONE"
		},
		{
			"req_id": "V1.3.10",
			"level": "L2",
			"applicability": "APPLICABLE",
			"reason": "",
			"controls": [
				"CR-INPUT-008"
			],
			"conformance_status": "NOT_DEMONSTRATED",
			"release_relevance": "SECURITY_DEBT"
		},
		{
			"req_id": "V1.3.11",
			"level": "L2",
			"applicability": "NOT_APPLICABLE",
			"reason": "No WYSIWYG/SVG/markdown-template user content, JNDI, memcache or mail system.",
			"controls": [],
			"conformance_status": "NOT_APPLICABLE",
			"release_relevance": "NONE"
		},
		{
			"req_id": "V1.3.12",
			"level": "L3",
			"applicability": "DEFERRED",
			"reason": "ASVS L3 not targeted by the CRSF 1.0 profile.",
			"controls": [],
			"conformance_status": "DEFERRED",
			"release_relevance": "NONE"
		},
		{
			"req_id": "V1.4.1",
			"level": "L2",
			"applicability": "NOT_APPLICABLE",
			"reason": "Managed JavaScript runtime only; no unmanaged/native code in the application.",
			"controls": [],
			"conformance_status": "NOT_APPLICABLE",
			"release_relevance": "NONE"
		},
		{
			"req_id": "V1.4.2",
			"level": "L2",
			"applicability": "NOT_APPLICABLE",
			"reason": "Managed JavaScript runtime only; no unmanaged/native code in the application.",
			"controls": [],
			"conformance_status": "NOT_APPLICABLE",
			"release_relevance": "NONE"
		},
		{
			"req_id": "V1.4.3",
			"level": "L2",
			"applicability": "NOT_APPLICABLE",
			"reason": "Managed JavaScript runtime only; no unmanaged/native code in the application.",
			"controls": [],
			"conformance_status": "NOT_APPLICABLE",
			"release_relevance": "NONE"
		},
		{
			"req_id": "V1.5.1",
			"level": "L1",
			"applicability": "NOT_APPLICABLE",
			"reason": "No XML parsing.",
			"controls": [],
			"conformance_status": "NOT_APPLICABLE",
			"release_relevance": "NONE"
		},
		{
			"req_id": "V1.5.2",
			"level": "L2",
			"applicability": "APPLICABLE",
			"reason": "",
			"controls": [
				"CR-DOC-002"
			],
			"conformance_status": "CONFORMANT",
			"release_relevance": "RELEASE_BLOCKING"
		},
		{
			"req_id": "V1.5.3",
			"level": "L3",
			"applicability": "DEFERRED",
			"reason": "ASVS L3 not targeted by the CRSF 1.0 profile.",
			"controls": [],
			"conformance_status": "DEFERRED",
			"release_relevance": "NONE"
		},
		{
			"req_id": "V2.1.1",
			"level": "L1",
			"applicability": "APPLICABLE",
			"reason": "",
			"controls": [
				"CR-INPUT-009"
			],
			"conformance_status": "NON_CONFORMANT",
			"release_relevance": "SECURITY_DEBT"
		},
		{
			"req_id": "V2.1.2",
			"level": "L2",
			"applicability": "APPLICABLE",
			"reason": "",
			"controls": [
				"CR-INPUT-009"
			],
			"conformance_status": "NON_CONFORMANT",
			"release_relevance": "SECURITY_DEBT"
		},
		{
			"req_id": "V2.1.3",
			"level": "L2",
			"applicability": "APPLICABLE",
			"reason": "",
			"controls": [
				"CR-RESOURCE-005",
				"CR-QUOTE-008"
			],
			"conformance_status": "NON_CONFORMANT",
			"release_relevance": "RELEASE_BLOCKING"
		},
		{
			"req_id": "V2.2.1",
			"level": "L1",
			"applicability": "APPLICABLE",
			"reason": "",
			"controls": [
				"CR-API-003",
				"CR-NEXUS-001",
				"CR-NEXUS-003",
				"CR-QUOTE-001",
				"CR-QUOTE-003",
				"CR-QUOTE-004",
				"CR-PURCHASE-003",
				"CR-PURCHASE-002"
			],
			"conformance_status": "CONFORMANT",
			"release_relevance": "RELEASE_BLOCKING"
		},
		{
			"req_id": "V2.2.2",
			"level": "L1",
			"applicability": "APPLICABLE",
			"reason": "",
			"controls": [
				"CR-API-003"
			],
			"conformance_status": "CONFORMANT",
			"release_relevance": "RELEASE_BLOCKING"
		},
		{
			"req_id": "V2.2.3",
			"level": "L2",
			"applicability": "APPLICABLE",
			"reason": "",
			"controls": [
				"CR-INPUT-010",
				"CR-NEXUS-001",
				"CR-NEXUS-002",
				"CR-QUOTE-002",
				"CR-PURCHASE-003",
				"CR-ALLOC-001",
				"CR-TERMS-001",
				"CR-PURCHASE-001",
				"CR-PURCHASE-002"
			],
			"conformance_status": "CONFORMANT",
			"release_relevance": "RELEASE_BLOCKING"
		},
		{
			"req_id": "V2.3.1",
			"level": "L1",
			"applicability": "APPLICABLE",
			"reason": "",
			"controls": [
				"CR-API-009",
				"CR-PURCHASE-005"
			],
			"conformance_status": "CONFORMANT",
			"release_relevance": "RELEASE_BLOCKING"
		},
		{
			"req_id": "V2.3.2",
			"level": "L2",
			"applicability": "APPLICABLE",
			"reason": "",
			"controls": [
				"CR-CONC-002",
				"CR-QUOTE-003",
				"CR-QUOTE-005",
				"CR-COMMISSION-001",
				"CR-ALLOC-001",
				"CR-TERMS-002",
				"CR-APPROVAL-001",
				"CR-PURCHASE-006",
				"CR-PURCHASE-007",
				"CR-PURCHASE-008"
			],
			"conformance_status": "NOT_DEMONSTRATED",
			"release_relevance": "RELEASE_BLOCKING"
		},
		{
			"req_id": "V2.3.3",
			"level": "L2",
			"applicability": "APPLICABLE",
			"reason": "",
			"controls": [
				"CR-CONC-001",